<?xml version="1.0" encoding="UTF-8"?>
<livre xmlns:xsi="http://www.w3.org/2001/XMLSchema-instance"
xsi:noNamespaceSchemaLocation="livre.xsd" isbn="978-2-7177-2113-4">
  <titre>XSD pour les nuls</titre>
  <auteur idAuteur="1">
    <nom>Dupond</nom>
    <prenom>Jean</prenom>
  </auteur>
  <auteur idAuteur="2">
    <nom>Dupont</nom>
    <prenom>Fred</prenom>
  </auteur>
  
  <presentation>Ce livre est une introduction au sch√©ma XSD</presentation>
  
</livre>